https://fatabyyano.net/%d8%a7%d9%84%d8%a8%d8%b7%d9%8a%d8%ae_%d8%a7%d9%84%d8%a3%d8%b2%d8%b1%d9%82/, ساخر, OTHER, ما حقيقة صورة البطيخ الأزرق(وينمو)؟, 2019-03-28, "أزرق,اليابان,بطيخ,‎#خرافة,‎#فتبينوا,ينمو,سياسي,ديني,علوم,علوم,طبي"
https://fatabyyano.net/%d8%b3%d8%b9%d9%88%d8%af%d9%8a-%d9%8a%d8%a3%d9%83%d9%84-%d8%a7%d8%ab%d9%86%d9%8a%d9%86-%d9%85%d9%86-%d8%b2%d9%88%d8%ac%d8%a7%d8%aa%d9%87/, ساخر, OTHER, ما حقيقة سعودي يأكل اثنين من زوجاته للنجاة بعد ضياعه في الصحراء لمدة 13 يوما؟, 2019-01-23, "اثنين,الرملة,الصحراء,‎#خرافة,زوجاته,سعودي,ضياعه,‎#فتبينوا,للنجاة,مصطفى_علي_حمد,يأكل,سياسي,ديني,علوم,علوم,طبي"
https://fatabyyano.net/pilgrim_throws_devil/, ساخر, OTHER, صورة مفبركة : حاج يرجم الشيطان بنبلة ( مقليعة ), 2019-01-03, "حاج,‎#خرافة,‎#فتبينوا,مقليعة,نبلة,يرجم,الشيطان,سياسي,ديني,علوم,علوم,طبي"
https://fatabyyano.net/american_house_horror_game_saudi_embassy/, ساخر, OTHER, ما حقيقة (فيديو) في أمريكا لعبة بيت الرعب في السفارة السعودية؟, 2018-12-19, "أمريكا,الرعب,السفارة,بيت,‎#خرافة,السعودية,حقيقة,سياسي,ديني,علوم,علوم,طبي"
https://fatabyyano.net/watch_flying_saucer_over_vatican/, ساخر, OTHER, ماحقيقة (فيديو) مشاهدة طبق طائر فوق الفاتيكان؟, 2018-12-04, "aliens,UFO,ufosighting,Vatican,WeAreNotAlone,أطباق_طائرة,طبق_طائر,فاتيكان,لسنا_وحدنا,مخلوقات_فضائية,خرافة,فتبينوا,سياسي,ديني,علوم,علوم,طبي"
https://fatabyyano.net/claim_man_from_argentina_adolf_hitler/, ساخر, OTHER, ما حقيقة ادعاء رجل من الأرجنتين أنه أدولف هتلر؟, 2018-11-25, "AdolfHitler,Argentina,Fake_News,FakeNews,Germany,Hitler,hoax,WorldNewsDailyReport,أدولف_هتلر,ألمانيا,ادعاء_كاذب,الأرجنتين,خبر_كاذب,فرانسيس_موريس,خرافة,فتبينوا,هتلر,سياسي,ديني,علوم,علوم,طبي"
https://fatabyyano.net/jellyfish_amman_sky_fly/, ساخر, OTHER, ما حقيقة (فيديو) كائن غريب يطير في سماء عمّان؟, 2018-09-25, "UFO,اجسام_غريبة_طائرة,فيديو_مفبرك,خرافة,فتبينوا,سياسي,ديني,علوم,علوم,طبي"
https://fatabyyano.net/drunken_prince_arab_london/, ساخر, OTHER, ما حقيقة (فيديو) أمير خليجي سكران يوزع الأموال على الإنجليز؟, 2018-09-06, "أمير_سعودي,اسراف,الانجليز,الخليج,خدعة,خرافة,فتبينوا,سياسي,ديني,علوم,علوم,طبي"
https://fatabyyano.net/aliens_american_sky/, ساخر, OTHER, ما حقيقة (فيديو) أجسام فضائية في سماء أمريكا؟, 2018-07-18, "امريكا,فضائيين,خرافة,فتبينوا,مؤامرة,سياسي,ديني,علوم,علوم,طبي"
https://fatabyyano.net/ketchup_truth_revealed/, ساخر, OTHER, ما حقيقة مكونات الكاتشب(فيديو)؟, 2018-07-02, "بول,دم_مخثر,كاتشب,كحول,كوكائين,خرافة,فتبينوا,سياسي,ديني,علوم,علوم,طبي"
https://fatabyyano.net/multiple_birth_17_baby_at_once/, ساخر, OTHER, ما حقيقة انجاب سيدة 17 طفل ببطن واحدة؟, 2018-05-05, "انجاب_17_طفل,انجاب_أكبر_عدد_مرة_واحدة,خرافة,فتبينوا,سياسي,ديني,علوم,علوم,طبي"
https://fatabyyano.net/rats_into_chicken/, ساخر, OTHER, ما حقيقة تحويل الفئران الى صدور دجاج؟, 2018-04-16, "صدور_دجاج,فئران,منظمة_الصحة_العالمية,خرافة,فتبينوا,سياسي,ديني,علوم,علوم,طبي"
https://fatabyyano.net/giant_head/, ساخر, OTHER, ما حقيقة اكتشاف رأس جالوت؟, 2018-03-16, "جالوث,رأس_عملاقة,هياكل_عملاقة,احافير,احفورة,خرافة,عملاق,فتبينوا,هيكل,سياسي,ديني,علوم,علوم,طبي"
https://fatabyyano.net/foreign_body_sky/, ساخر, OTHER, ما حقيقة ظهور جسم غريب فى السماء؟, 2018-03-11, "جسم_غريب,خرافة,سماء,فتبينوا,سياسي,ديني,علوم,علوم,طبي"
https://fatabyyano.net/%d8%a7%d9%81%d8%aa%d8%aa%d8%a7%d8%ad-%d9%85%d8%b7%d8%b9%d9%85-%d9%84%d9%84%d8%ad%d9%88%d9%85-%d8%a7%d9%84%d8%a8%d8%b4%d8%b1-%d9%81%d9%8a-%d8%a7%d9%84%d9%8a%d8%a7%d8%a8%d8%a7%d9%86/, ساخر, OTHER, ماحقيقة افتتاح مطعم للحوم البشر في اليابان؟, 2017-12-25, "اليابان,خرافة#فتبينوا,طوكيو,لحم_البشر,سياسي,ديني,علوم,علوم,طبي"
https://fatabyyano.net/girl_die_singing/, ساخر, OTHER, ما حقيقة وفاة فتاة تركية وهى تغنى مات الحب؟, 2017-12-03, "انستجرام,غناء,مات_الحب,وفاة,خرافة,فتبينوا,سياسي,ديني,علوم,علوم,طبي"
https://fatabyyano.net/shampoo/, ساخر, OTHER, خرافة : شامبو للمحجبات في ماليزيا !, 2017-10-04, "اعلان,حجاب,خرافة,شامبو,فتبينوا,ماليزي,ماليزيا,محجبات,سياسي,ديني,علوم,علوم,طبي"
https://fatabyyano.net/%d8%aa%d9%86%d8%a7%d9%88%d9%84_%d8%a7%d9%84%d8%ad%d8%b4%d8%b1%d8%a7%d8%aa_%d8%b3%d8%a8%d8%a8_%d9%81%d9%8a%d8%b1%d9%88%d8%b3_%d9%83%d9%88%d8%b1%d9%88%d9%86%d8%a7/, رأي, OTHER, هل تناول الحشرات و الحيوانات الغريبة هي سبب ظهور فيروس كورونا, 2020-01-29, "الأفاعي,الصين,الغذاء,الوطواط,تناول الحيوانات,فيروس كورونا,سياسي,ديني,علوم,علوم,طبي"
https://fatabyyano.net/%d9%85%d9%82%d8%af%d9%85%d8%a9-%d9%85%d8%ae%d8%aa%d8%b5%d8%b1%d8%a9-%d8%b9%d9%86-%d9%81%d9%8a%d8%b1%d9%88%d8%b3-%d9%83%d9%88%d8%b1%d9%88%d9%86%d8%a7/, رأي, OTHER, مقدمة مختصرة عن فيروس كورونا الصين, 2020-01-27, "الوقاية,طب,كورونا,سياسي,ديني,علوم,علوم,طبي"
https://fatabyyano.net/%d9%87%d9%84-%d9%86%d8%ad%d9%86-%d8%a8%d8%a7%d9%84%d9%81%d8%b9%d9%84-%d9%86%d8%b3%d8%aa%d8%ae%d8%af%d9%85-%d9%85%d8%a7-%d9%85%d9%82%d8%af%d8%a7%d8%b1%d9%87-10-%d9%81%d9%82%d8%b7-%d9%85%d9%86-%d8%b7/, رأي, OTHER, هل نحن بالفعل نستخدم ما مقداره 10% فقط من طاقة دماغنا؟!, 2020-01-15, "10%,استخدام,العقل#البشري,العلم,قدرة#الدماغ,خرافة,فتبينوا,سياسي,ديني,علوم,علوم,طبي"
https://fatabyyano.net/%d8%a7%d9%84%d8%aa%d8%af%d8%a7%d9%88%d9%8a-%d8%a8%d8%a7%d9%84%d8%a3%d8%b9%d8%b4%d8%a7%d8%a8-%d8%a7%d9%84%d8%b7%d8%a8%d9%8a%d8%b9%d9%8a%d8%a9-%d9%88%d8%a7%d9%84%d8%a3%d8%af%d9%88%d9%8a%d8%a9-%d8%a7/, رأي, OTHER, التداوي بالأعشاب الطبيعية والأدوية المصنعة… أيهما أفضل؟, 2020-01-12, "طب_بديل,ادوية,اعشاب,امراض,خلطة_اعشاب,دواء,صحة,صيدلة,عطار,عطارة,علاج,علاج_آمن,مستحضر_طبيعي,وصفة_طبية,سياسي,ديني,علوم,علوم,طبي"
https://fatabyyano.net/%d8%a7%d9%84%d8%b9%d9%84%d9%82-%d9%88%d8%a7%d8%b3%d8%aa%d8%ae%d8%af%d8%a7%d9%85%d8%a7%d8%aa%d9%87-%d8%a7%d9%84%d8%b7%d8%a8%d9%8a%d8%a9%d8%8c-%d8%a8%d9%8a%d9%86-%d8%a7%d9%84%d8%b5%d8%ad%d9%8a/, رأي, OTHER, العلق واستخداماته الطبية، بين الصحيح والخاطئ, 2019-10-10, "الطب,العلق,تصحيح,خرافة,علاج,سياسي,ديني,علوم,علوم,طبي"
https://fatabyyano.net/%d8%b4%d8%a8%d9%83%d8%a7%d8%aa-5g-%d9%88%d9%86%d9%87%d8%a7%d9%8a%d8%a9-%d8%a7%d9%84%d8%a5%d9%86%d8%b3%d8%a7%d9%86/, رأي, OTHER, شبكات 5G ونهاية الإنسان, 2019-08-02, "سياسي,ديني,علوم,علوم,طبي"
https://fatabyyano.net/%d8%a3%d9%86%d9%82%d9%80%d8%aa%d9%84-%d8%a7%d9%84%d8%ae%d9%8f%d8%b1%d8%a7%d9%81%d8%a9-%d8%a3%d9%85-%d9%86%d9%80%d9%86%d8%aa%d8%b8%d8%b1-%d9%84%d8%aa%d9%82%d8%aa%d9%84%d9%86%d8%a7/, رأي, OTHER, أنقـتُل الخرافة أم ننتظر لتقتلنا؟, 2019-05-01, "العلاج_الكيميائي,العلندة,العليق,الفدر,اللقاحات,علاج_السرطان_بالأعشاب,مخاطر_العلندة,التوحد,السرطان,القعود,فتبينوا,موت,سياسي,ديني,علوم,علوم,طبي"
https://fatabyyano.net/masidharam/, رأي, OTHER, حادثة حشرات الحرم .. بين الحقيقة والخرافة والصور المفبركة والتأويلات والاتهامات!, 2019-01-11, "طائرة,كعبة,مكة,اسراب,الحرم,جراد,حشرات,حشرة,حقيقة,سرب,صراصير,صرصور,على,غزو,فتبينوا,مكرمة,هجوم,سياسي,ديني,علوم,علوم,طبي"
https://fatabyyano.net/ten_famous_false_news_spread_2018/, رأي, OTHER, أشهر 10 أخبار كاذبة انتشرت في 2018, 2018-12-31, "kiki,أم,أهلها,أول,استنساخ,الأخيرة,الإندونيسي,الإندونيسية,الرصاص,الطائرة,اللحظات,اليابان,انفجار,بورما,تبرعوا,تغير,تقطيع,جثة,حادث,خاشقجى,‎#خرافة,خروف,خنزير,داخل,رقصة,رميا,روبوتات,سائل,سبيدة,صور,ضحية,عدم,عمر,‎#فتبينوا,فك,قلبها,ماتت,مجمدة,مخلوق,منطاد,ناتج,نيتروجين,هوائي,يعالج,السرطان,الصين,دواء,سياسي,ديني,علوم,علوم,طبي"
https://fatabyyano.net/pubg_violence_myth/, رأي, OTHER, توقفوا عن نشر الخرافات، PUBG لا تسبب العنف لدى مستخدميها !, 2018-12-15, "pubg,ألعاب_عنف,الإعلام,الحقيقة,ببجي,مقالات_علمية,عنف,فتبينوا,سياسي,ديني,علوم,علوم,طبي"
https://fatabyyano.net/8vaccines/, رأي, OTHER, السؤال الشهير: هل اللقاحات تسبب التوحد؟, 2018-12-08, "سياسي,ديني,علوم,علوم,طبي"
https://fatabyyano.net/%d9%87%d8%a7%d8%aa%d9%81%d9%83_%d8%a7%d9%84%d8%b0%d9%83%d9%8a/, رأي, OTHER, هل يعتبر هاتفك الذكي حقاً مسبباً للسرطان؟, 2018-11-25, "RF waves,دراسات بشرية,دراسات حيوانية,سرطان الدماغ,هاتف نقال,سياسي,ديني,علوم,علوم,طبي"
https://fatabyyano.net/milk_treatment_peptic_ulcer/, رأي, OTHER, هل الحليب مفيد لقرحة المعدة؟, 2018-10-28, "جرثومة_المعدة,حليب,حمية_غذائية,قرحة,قرحة_المعدة,قهوة,كوكاكولا,لبن,مقالات_علمية,نسكافية,صحة,طب,فتبينوا,مرض,سياسي,ديني,علوم,علوم,طبي"
https://fatabyyano.net/%d8%ad%d9%82%d9%8a%d9%82%d8%a9-%d8%a7%d9%84%d8%b5%d9%88%d8%b1-%d9%88-%d8%a7%d9%84%d8%a3%d8%ae%d8%a8%d8%a7%d8%b1-%d8%a7%d9%84%d9%85%d8%aa%d8%af%d8%a7%d9%88%d9%84%d8%a9-%d8%b9%d9%86/, رأي, OTHER, حقيقة الصور و الأخبار المتداولة عن حادثة البحر الميت في الأردن, 2018-10-27, "البحر_الميت,سيول,حادثة,سياسي,ديني,علوم,علوم,طبي"
https://fatabyyano.net/facebook_brain_usage_social_network/, رأي, OTHER, أخبرني كيف تستخدم الفيس بوك…. أخبرك كيف يعمل دماغك., 2018-10-07, "الدماغ,شبكة_الدماغ_الاجتماعية,فيس_بوك,مقالات_علمية,سياسي,ديني,علوم,علوم,طبي"
https://fatabyyano.net/fake_news_spread_rapidly_twitter/, رأي, OTHER, الأخبار الكاذبة تنتشر أسرع من الأخبار الحقيقة… من الملام؟, 2018-09-08, "أخبار_حقيقية,أخبار_كاذبة,تويتر,دراسة,فيس_بوك,مقالات_علمية,فتبينوا,سياسي,ديني,علوم,علوم,طبي"
https://fatabyyano.net/memory/, رأي, OTHER, زراعة الأعضاء وانتقال الذاكرة.. زيف هوليوود أم حقيقة؟, 2018-09-02, "البيبتايدات,الذاكرة الخلوية,تغيرات شخصية,ذاكرة,زراعة الأعضاء,كلير سيلفيا,سياسي,ديني,علوم,علوم,طبي"
https://fatabyyano.net/%d8%a7%d9%84%d8%b6%d8%b1%d8%a8_%d9%88%d8%b3%d9%8a%d9%84%d8%a9_%d8%aa%d8%b1%d8%a8%d9%8a%d8%a9_%d8%a3%d9%85_%d8%ac%d8%b1%d9%8a%d9%85%d8%a9/, رأي, OTHER, الضرب: وسيلة تربية أم جريمة بحق الأبناء؟, 2018-08-27, "ابوة,اساليب_تربوية,امومة,تربية,تربية_الابناء,ضرب_الابناء,طفل,عائلة,عقاب,عنف,سياسي,ديني,علوم,علوم,طبي"
https://fatabyyano.net/are_psychiatric_drugs_safe/, رأي, OTHER, هل الأدوية النفسيّة آمنة؟, 2018-07-08, "وسواس_قهري,ادوية,ادوية_نفسية,اكتئاب,شخصية,صحة,صحة_نفسية,علاج,قلق,نفسية,هلع,سياسي,ديني,علوم,علوم,طبي"
https://fatabyyano.net/%d8%b7%d9%82%d8%b7%d9%82%d8%a9-%d8%a7%d9%84%d8%a3%d8%b5%d8%a7%d8%a8%d8%b9-%d9%84%d8%a7-%d8%aa%d8%b3%d8%a8%d8%a8-%d8%b6%d8%b1%d8%b1%d8%a7%d9%8b-%d9%84%d9%84%d9%85%d9%81%d8%a7%d8%b5%d9%84-%d9%83/, رأي, OTHER, مضار “طقطقة الأصابع” بين المعتقد السائد والعلم المثبت.. أيهما يفوز؟, 2018-06-20, "Donald Unger,Ig Nobel Prize,synovial fluid,التهاب المفاصل,طقطقة الأصابع,قوة قبضة اليد,سياسي,ديني,علوم,علوم,طبي"
https://fatabyyano.net/vegetarian_science/, رأي, OTHER, هل العلم يؤيد النباتيّة؟, 2018-06-16, "لحوم,انسانية,تغذية,خضرية,صحة,غذاء,نباتية,نظام_غذائي,نمط_حياة,وزن,سياسي,ديني,علوم,علوم,طبي"
https://fatabyyano.net/%d8%b9%d9%84%d8%a7%d8%ac-%d8%a7%d9%84%d8%b3%d8%b1%d8%b7%d8%a7%d9%86-%d8%a8%d8%a7%d9%84%d8%b5%d9%8a%d8%a7%d9%85/, رأي, OTHER, علاج السرطان بالصيام.. ما مدى صحة الموضوع؟, 2018-06-07, "الالتهام_الذاتي,الصيام,الصيام_المتقطع,تجويع_السرطان,علاج_السرطان,سياسي,ديني,علوم,علوم,طبي"
https://fatabyyano.net/laurel_sound_like_yanny/, رأي, OTHER, ما تفسير ظاهرة ياني ولورال؟, 2018-05-20, "التفسير_العلمي,حقيقة_ياني_لورال,مقالات_علمية,سياسي,ديني,علوم,علوم,طبي"
https://fatabyyano.net/aspartum/, رأي, OTHER, أضرار المُحليات الاصطناعيّة حقيقة أم لا؟؟!!, 2018-04-27, "FDA,PKU,أسبارتم,الحد المسموح,جمعية السرطان الأمريكية,فينيل ألانين,محليات اصطناعية,مشروبات غازية,إنقاص الوزن,دايت,سرطان,سكر,سياسي,ديني,علوم,علوم,طبي"
https://fatabyyano.net/cancer_treatments/, رأي, OTHER, العلاجات الطبيعية للسرطان؛ عندما تستخدم آلام لناس لخداعهم., 2018-03-24, "البول,حبة_البركة,شجرة_طقسوس,غير_حقيقي,فيتامين_سي,السرطان,علاج,وهم,سياسي,ديني,علوم,علوم,طبي"
https://fatabyyano.net/autism/, رأي, OTHER, التوحّد بين اعتدال العلم وغلوّ هوليوود, 2018-03-17, "التوحد,الطبيب_الجيّد,الطيف_التوحدي,المطاعيم_اللقاحات,بيج_بانج_ثيوري,خرافة,شيلدون,صورة_غير_حقيقية,هوليوود,سياسي,ديني,علوم,علوم,طبي"
https://fatabyyano.net/vitamins/, رأي, OTHER, شائعات حول الفيتامينات, 2018-03-10, "B17,السرطان,الفيتامينات,خرافة,شائعات,علاج,فيتامين_C,سياسي,ديني,علوم,علوم,طبي"
https://fatabyyano.net/flat_earth/, رأي, OTHER, 10 أدلة سهلة لدحض خرافة “الأرض المسطحة”, 2018-03-03, "الأرض,الأرض_كروية!,خرافة,عشر_أدلة,مسطحة,سياسي,ديني,علوم,علوم,طبي"
https://fatabyyano.net/acupuncture/, رأي, OTHER, الابر الصينيّة-بين الخرافة والحقيقة, 2018-02-24, "الابر,البديل,الصينيّة,العلاج,الهروب,بالوهم,من_الألم,الطب,سياسي,ديني,علوم,علوم,طبي"
https://fatabyyano.net/%d8%a7%d9%84%d8%b9%d9%84%d9%86%d8%af%d8%a9-%d9%84%d8%a7-%d8%aa%d8%b4%d9%81%d9%8a-%d9%85%d9%86-%d8%a7%d9%84%d8%b3%d8%b1%d8%b7%d8%a7%d9%86/, رأي, OTHER, العلندة لا تشفي من السرطان!, 2018-02-16, "أكاذيب,السحرية,العشبة,العلندة,تؤدي_للموت,ستيفين_بيكل,السرطان,خرافة,علاج,سياسي,ديني,علوم,علوم,طبي"
https://fatabyyano.net/xpseudoscience/, رأي, OTHER, كيف نتعرف على العلم الزائف؟ ( 9 علامات تخبرك بذلك ), 2018-02-10, "Pseudoscience,الزائف,العلم,فروقات,خرافة,سياسي,ديني,علوم,علوم,طبي"
https://fatabyyano.net/3546-2/, رأي, OTHER, العلاج بالوهم .. حقيقة أم خرافة !, 2018-01-20, "placebo,خداع,خرافات,طبيب,علاج,علاج بديل,وهم,سياسي,ديني,علوم,علوم,طبي"
https://fatabyyano.net/social_experiment/, رأي, OTHER, اختبارات الشخصية .. حقيقة أم وهم ؟, 2017-12-19, "سياسي,ديني,علوم,علوم,طبي"
https://fatabyyano.net/pesticide_food_cancer/, رأي, OTHER, هل المبيدات الحشرية تسرطن أغذيتنا ؟, 2017-11-20, "مبيدات_حشرية,محاصيل_غذائية,سرطان,غذاء,سياسي,ديني,علوم,علوم,طبي"
https://fatabyyano.net/conspiracy_theory_special/, رأي, OTHER, هل يعتنق الناس نظريات المؤامرة للشعور بالتميز؟ , 2017-10-14, "احداث 11 سبتمبر,انفراد,تفاخر,تميز,خالف,خرافات,شهره,عقدة النقص,فتبينوا,مؤامرة,نظرية,سياسي,ديني,علوم,علوم,طبي"
https://fatabyyano.net/is_cancer_meam_death/, رأي, OTHER, هل مـريض السـرطان مـحكوم عـليه بالمـوت ؟, 2017-10-10, "الحاله النفسية,النهاية,خرافة,خرافه,سرطان,معدل البقاء,موت,سياسي,ديني,علوم,علوم,طبي"
https://fatabyyano.net/%d9%88%d9%81%d8%a7%d8%a9-%d8%a7%d9%84%d8%b4%d9%8a%d8%ae-%d8%b7%d9%84%d8%ad%d8%a9-%d8%a7%d9%84%d9%85%d8%b5%d8%b1%d9%8a-%d9%88%d9%87%d9%88-%d9%8a%d8%a4%d9%85-%d8%a7%d9%84/, عنوان مضلل, MIXTURE, وفاة الشيخ طلحة المصري وهو يؤم المصلين بصلاة الفجر!ما حقيقة ذلك؟, 2020-01-30, "وفاة,الشيخ,طلحة_المصري,سياسي,ديني,علوم,علوم,طبي"
https://fatabyyano.net/%d8%aa%d8%af%d9%81%d9%82-%d8%a7%d9%84%d8%af%d9%85%d8%a7%d8%a1-%d9%85%d9%86-%d8%a7%d9%84%d8%a3%d8%b1%d8%b6-%d9%81%d9%8a-%d8%b4%d9%88%d8%a7%d8%b1%d8%b9-%d8%aa%d8%b1%d9%83%d9%8a%d8%a7-%d8%a8%d8%b9%d8%af/, عنوان مضلل, MIXTURE, تدفق الدماء من الأرض في شوارع تركيا بعد الزلزال الأخير!(فيديو) ما حقيقة ذلك؟, 2020-01-30, "تركيا,الدماء,تدفق,سياسي,ديني,علوم,علوم,طبي"
https://fatabyyano.net/%d8%ad%d9%82%d9%8a%d9%82%d8%a9-%d9%81%d9%8a%d8%af%d9%8a%d9%88%d8%b5%d8%b1%d8%a7%d8%ae-%d9%88%d8%b9%d9%88%d9%8a%d9%84-%d9%88%d8%b1%d8%b9%d8%a8-%d8%b3%d9%83%d8%a7%d9%86-%d9%85%d8%af%d9%8a%d9%86/, عنوان مضلل, MIXTURE, حقيقة (فيديو) صراخ وعويل ورعب سكان مدينة ووهان الصينية بسبب فيروس كورونا, 2020-01-29, "صراخ,كورونا,ووهان,سياسي,ديني,علوم,علوم,طبي"
https://fatabyyano.net/%d8%ad%d9%82%d9%8a%d9%82%d8%a9-%d9%81%d9%8a%d8%af%d9%8a%d9%88-%d8%b3%d9%82%d9%88%d8%b7-%d8%a7%d9%84%d8%b4%d8%a7%d8%a8-%d8%ac%d8%a7%d8%b1%d9%8a-%d9%85%d9%86-%d9%81%d9%88%d9%82-%d8%a5%d8%ad%d8%af/, عنوان مضلل, MIXTURE, حقيقة (مقطع) سقوط الشاب جاري من فوق إحدى ناطحات السحاب, 2020-01-23, "سقوط,شاب,ناطحة_سحاب,سياسي,ديني,علوم,علوم,طبي"
https://fatabyyano.net/%d8%ac%d8%a7%d9%85%d8%b9%d8%a9-%d9%87%d8%a7%d8%b1%d9%81%d8%b1%d8%af-%d8%aa%d8%b5%d9%86%d9%81-%d8%a7%d9%84%d9%82%d8%b1%d8%a2%d9%86-%d8%a7%d9%84%d9%83%d8%b1%d9%8a%d9%85-%d9%83%d8%a3%d9%81%d8%b6%d9%84/, عنوان مضلل, MIXTURE, جامعة هارفرد تصنف القرآن الكريم كأفضل كتاب للعدالة، معلومة خاطئة, 2020-01-20, "القرأن_الكريم,تصنيف,جامعة_هارفارد,سياسي,ديني,علوم,علوم,طبي"
https://fatabyyano.net/%d8%a5%d9%81%d8%a7%d9%82%d8%a9-%d8%b4%d8%a7%d8%a8-%d9%85%d9%86-%d8%a7%d9%84%d9%85%d9%88%d8%aa-%d8%a8%d8%b9%d8%af-%d8%ba%d8%b3%d9%84%d9%87-%d8%a5%d8%ab%d8%b1-%d8%a5%d8%b5%d8%a7%d8%a8%d8%aa%d9%87/, عنوان مضلل, MIXTURE, إفاقة شاب من الموت بعد غسله إثر إصابته بسكتة قلبية ،ما حقيقة ذلك ؟, 2020-01-16, "إفاقة_شاب,الموت,سكتة_قلبية,سياسي,ديني,علوم,علوم,طبي"
https://fatabyyano.net/%d8%a7%d9%84%d8%b4%d9%91%d8%b1%d8%a8-%d8%a7%d9%84%d9%85%d8%a8%d8%a7%d8%b4%d8%b1-%d9%85%d9%86-%d8%a7%d9%84%d8%b9%d8%a8%d9%88%d8%a7%d8%aa%d8%8c%d9%87%d9%84-%d9%8a%d8%aa%d8%b3%d8%a8%d8%a8-%d9%81%d9%8a/, عنوان مضلل, MIXTURE, الشّرب المباشر من العبوات، هل يتسبب في إصابة أجسامنا بالدّيدان؟ (فيديو), 2020-01-11, "الديدان,الشرب,سياسي,ديني,علوم,علوم,طبي"
https://fatabyyano.net/%d8%a7%d9%84%d8%b5%d9%88%d8%b1-%d8%a7%d9%84%d8%a3%d9%88%d9%84%d9%89-%d8%a7%d9%84%d9%85%d8%aa%d8%af%d8%a7%d9%88%d9%84%d8%a9-%d9%84%d8%af%d9%85%d8%a7%d8%b1-%d9%82%d8%a7%d8%b9%d8%af%d8%a9-%d8%b9/, عنوان مضلل, MIXTURE, الصور الأولى المتداولة لدمار قاعدة عين الأسد! ولكن الصور قديمة., 2020-01-08, "إيران,العدوان_الإسرائيلي,القواعد_الأمريكية,عين_أسد,غزة,فتبينوا,سياسي,ديني,علوم,علوم,طبي"
https://fatabyyano.net/%d8%a7%d9%84%d8%b5%d8%ad%d8%a7%d9%81%d8%a9-%d8%aa%d8%af%d8%b9%d9%8a-%d9%88%d8%b5%d9%88%d9%84-%d8%a3%d9%88%d9%84-%d8%b5%d9%88%d8%b1-%d9%84%d8%af%d9%85%d8%a7%d8%b1-%d9%82%d8%a7%d8%b9%d8%af%d8%a9-%d8%b9/, عنوان مضلل, MIXTURE, تويتات تدعي وصول أول صور لدمار قاعدة عين الأسد! ولكن الصور قديمة., 2020-01-08, "سياسي,ديني,علوم,علوم,طبي"
https://fatabyyano.net/%d9%82%d9%86%d8%b5-%d8%b5%d9%82%d8%b1-%d9%84%d8%b7%d8%a7%d8%a6%d8%b1%d8%a9-%d8%aa%d8%ac%d8%b3%d8%b3-%d8%a5%d8%b3%d8%b1%d8%a7%d8%a6%d9%8a%d9%84%d9%8a%d8%a9-%d9%81%d9%8a-%d8%ba%d8%b2/, عنوان مضلل, MIXTURE, صقر يقتنص طائرة تجسس إسرائيلية بدون طيار في غزة … ما حقيقة ذلك ؟, 2019-11-27, "إسرائيل,التجسس,الدرون,الصقر,‎#خرافة,‎#فتبينوا,غزة,سياسي,ديني,علوم,علوم,طبي"
https://fatabyyano.net/%d8%b4%d8%a7%d8%a8-%d9%8a%d8%b9%d8%aa%d8%af%d9%8a-%d8%b9%d9%84%d9%89-%d9%85%d9%86-%d8%a3%d8%ad%d8%b1%d9%82-%d8%a7%d9%84%d9%82%d8%b1%d8%a2%d9%86-%d8%a7%d9%84%d9%83%d8%b1%d9%8a%d9%85/, عنوان مضلل, MIXTURE, شاب يعتدي على من أحرق القرآن الكريم في النرويج!..تعرف على حقيقة جنسيته, 2019-11-24, "النرويج,حرق_القرآن,سياسي,ديني,علوم,علوم,طبي"
https://fatabyyano.net/%d8%ad%d9%85%d9%84%d8%a7%d8%aa-%d9%84%d9%86%d8%b4%d8%b7%d8%a7%d8%a1-%d8%a3%d9%88%d8%b1%d9%88%d8%a8%d9%8a%d9%8a%d9%86-%d9%84%d9%85%d9%82%d8%a7%d8%b7%d8%b9%d8%a9/, عنوان مضلل, MIXTURE, حملات لنشطاء أوروبيين لمقاطعة شركة كوكاكولا من أجل الفلسطينين .. حقيقة أم خرافة ؟, 2019-11-23, "دعم_القضية_الفلسطينية,كوكا_كولا,مقاطعة,سياسي,ديني,علوم,علوم,طبي"
https://fatabyyano.net/%d8%b4%d8%ac%d8%b1%d8%a9-%d8%aa%d9%86%d8%a8%d8%aa-%d8%a8%d8%b4%d9%83%d9%84-%d9%85%d9%81%d8%a7%d8%ac%d8%a6-%d8%aa%d8%ae%d8%aa%d8%b1%d9%82/, عنوان مضلل, MIXTURE, شجرة تنبت بشكل مفاجئ وتخترق سيارة من الأسفل!(فيديو)…حقيقة أم خرافة؟, 2019-11-20, "تخترق,سيارة,شجرة,سياسي,ديني,علوم,علوم,طبي"
https://fatabyyano.net/%d9%81%d9%8a%d8%af%d9%8a%d9%88-%d8%b3%d9%85%d9%83%d8%a9-%d8%a8%d9%88%d8%ac%d9%87-%d8%a5%d9%86%d8%b3%d8%a7%d9%86-%d8%aa%d8%b3%d8%a8%d8%ad/, عنوان مضلل, MIXTURE, فيديو يعرض سمكة بوجه إنسان وهي تسبح في الماء!…حقيقة أم خرافة؟, 2019-11-16, "إنسان,سمكة,خرافة,فتبينوا,وجه,سياسي,ديني,علوم,علوم,طبي"
https://fatabyyano.net/%d8%b7%d9%81%d9%84-%d9%85%d9%8a%d8%aa-%d9%8a%d9%85%d8%b3%d9%83-%d9%8a%d8%af-%d9%88%d8%a7%d9%84%d8%af%d9%87-%d8%b9%d9%86%d8%af-%d8%a7%d9%84%d9%82%d8%a8%d8%b1/, عنوان مضلل, MIXTURE, طفل ميت يمسك يد والده عند القبر وقبل دفنه!..حقيقة أم خرافة؟(فيديو), 2019-11-05, "والده,يد,يمسك,طفل,سياسي,ديني,علوم,علوم,طبي"
